{"$id":"https://offdata.local/schemas/current-operational-state.schema.json","$schema":"https://json-schema.org/draft/2020-12/schema","additionalProperties":false,"properties":{"allowed_scope":{"items":{"type":"string"},"minItems":10,"type":"array","uniqueItems":true},"boundaries":{"additionalProperties":{"type":"boolean"},"required":["founder_accountability_preserved","phase0_implementation_authorized","phase0_merge_authorized","phase1_authorized","merge_authorized","runtime_activation_authorized","hermes_activation_authorized","northstar_implementation_authorized","real_client_data_enabled","external_actions_authorized","paid_services_authorized","oauth_authorized","production_deployment_authorized","autonomous_merge_authorized"],"type":"object"},"canonical_branch":{"const":"main"},"current_authority":{"additionalProperties":true,"required":["controlling_instruction","operational_state","human_status","machine_handoff","canonical_issue_body","hosted_controls_issue_body","launch_semantics_repair","permanent_release","launch_entrypoint","permanent_release_gate","permit_schema","evidence_templates"],"type":"object"},"generated_from":{"const":"configs/current-operational-state.yaml"},"historical_package_snapshots":{"items":{"additionalProperties":false,"properties":{"classification":{"enum":["retained_historical_package_snapshot","retained_corrective_package_snapshot"]},"package":{"minLength":1,"type":"string"},"path":{"minLength":1,"type":"string"}},"required":["path","package","classification"],"type":"object"},"minItems":15,"type":"array"},"introduced_by":{"const":"PCFA-02"},"launch_permit":{"additionalProperties":true,"required":["output_directory","output_path","file_mode","single_use","commit_prohibited","stale_on_main_advance","stale_on_permanent_release_change","stale_on_current_operational_state_change","stale_on_issue_body_change","stale_on_evidence_digest_change"],"type":"object"},"launch_target":{"additionalProperties":false,"properties":{"implementation_may_start_only_after_valid_permit":{"const":true},"merge_authorized":{"const":false},"permitted_phase":{"const":"Codex Phase 0 only"},"permitted_tasks":{"const":["P0.1","P0.2","P0.3","P0.4"]},"phase1_authorized":{"const":false},"required_branch":{"const":"codex/phase-0-foundation"},"required_first_commit_ack":{"const":"governance/codex-phase0-launch-ack.json"},"required_pull_request_state":{"const":"draft"},"required_status_check":{"const":"Validate final pre-Codex canonical handoff and complete release"}},"required":["permitted_phase","permitted_tasks","required_branch","required_pull_request_state","required_first_commit_ack","required_status_check","implementation_may_start_only_after_valid_permit","merge_authorized","phase1_authorized"],"type":"object"},"live_issue_expectations":{"type":"object"},"manual_launch_gates":{"additionalProperties":{"const":false},"required":["github_hosted_controls_verified","historical_branch_cleanup_complete","clean_macos_environment_verified","explicit_founder_phase0_approval_received","approved_main_sha_bound","launch_permit_issued","codex_start_authorized"],"type":"object"},"projection_id":{"const":"CURRENT-OPERATIONAL-STATE"},"prohibited_scope":{"items":{"type":"string"},"minItems":14,"type":"array","uniqueItems":true},"release_semantics":{"additionalProperties":false,"properties":{"main_binding_semantics":{"const":"release_parent_main_sha_is_exact_integrated_main_before_release_record_commit"},"record_type":{"const":"permanent_post_merge_release"},"release_id":{"const":"PRE-CODEX-FINAL-RECONCILIATION-2026-08-06"},"release_parent_excluded_from_current_launch_sha_equality":{"const":true},"release_parent_must_be_ancestor_of_approved_launch_main":{"const":true},"release_record_commit_excluded_from_current_launch_sha_equality":{"const":true},"release_record_commit_must_be_ancestor_of_approved_launch_main":{"const":true}},"required":["release_id","record_type","main_binding_semantics","release_parent_must_be_ancestor_of_approved_launch_main","release_record_commit_must_be_ancestor_of_approved_launch_main","release_parent_excluded_from_current_launch_sha_equality","release_record_commit_excluded_from_current_launch_sha_equality"],"type":"object"},"repository":{"const":"rayrayxing/offdata-os"},"repository_readiness":{"additionalProperties":{"const":true},"required":["chat_first_specification_complete","workstream6_permanent_release_verified","pcfa01_launch_semantics_repaired","pcfa02_current_projection_active","repository_side_corrective_work_complete"],"type":"object"},"required_preflight_commands":{"items":{"type":"string"},"minItems":5,"type":"array","uniqueItems":true},"schema_version":{"const":"1.0.0"},"state_semantics":{"additionalProperties":{"const":true},"required":["historical_snapshot_fields_are_package_time_facts","historical_snapshot_readiness_must_not_drive_current_launch_decisions","current_operational_state_is_the_only_live_machine_readiness_projection","immutable_release_is_evidence_not_current_launch_sha","release_parent_main_sha_is_historical","current_launch_sha_is_bound_only_at_manual_evidence_and_permit_time"],"type":"object"},"status":{"const":"repository_corrective_state_ready_manual_launch_gates_pending"},"sync_policy":{"additionalProperties":{"const":true},"required":["current_issue_files_must_be_synced_only_after_their_repository_change_is_integrated","permit_fails_closed_until_live_issue_bodies_match_current_files"],"type":"object"},"title":{"const":"Current operational state and authority projection"}},"required":["schema_version","projection_id","introduced_by","title","repository","canonical_branch","status","generated_from","current_authority","historical_package_snapshots","state_semantics","release_semantics","launch_target","launch_permit","allowed_scope","prohibited_scope","repository_readiness","manual_launch_gates","live_issue_expectations","sync_policy","required_preflight_commands","boundaries"],"title":"offdata current operational state","type":"object"}
