{"allowed_scope":["validate_complete_chat_first_repository","verify_final_workstream6_release","create_codex_phase0_branch_after_permit","implement_p0_1_repository_baseline","implement_p0_2_local_development_environment","implement_p0_3_engineering_quality_baseline","implement_p0_4_security_and_operating_documentation","use_synthetic_data_only","open_draft_pull_request","stop_at_phase0_founder_gate"],"boundaries":{"autonomous_merge_authorized":false,"external_actions_authorized":false,"founder_accountability_preserved":true,"hermes_activation_authorized":false,"merge_authorized":false,"northstar_implementation_authorized":false,"oauth_authorized":false,"paid_services_authorized":false,"phase0_implementation_authorized":false,"phase0_merge_authorized":false,"phase1_authorized":false,"production_deployment_authorized":false,"real_client_data_enabled":false,"runtime_activation_authorized":false},"canonical_branch":"main","current_authority":{"canonical_issue_body":"handoff/codex-phase0-current-issue.md","codex_implementation_backlog_reconciliation":"requirements/pcfa07-codex-implementation-backlog-reconciliation.json","codex_implementation_backlog_reconciliation_sha256":"a0c30153516cc0a10ff50a7b30df811058557280ac205e6e1f78b88dcecc5c05","controlling_instruction":"AGENTS.md","evidence_templates":{"clean_macos":"handoff/codex-phase0-current-clean-macos-attestation.template.json","founder_approval":"handoff/codex-phase0-current-founder-authorization.template.json","hosted_controls":"handoff/codex-phase0-current-hosted-controls-attestation.template.json","launch_ack":"handoff/codex-phase0-current-launch-ack.template.json"},"final_pre_codex_cross_authority_acceptance":"repository/pcfa08-final-pre-codex-cross-authority-acceptance.json","final_pre_codex_cross_authority_acceptance_sha256":"11e23dbaaba7aec6ff63ab279fcf168e026069bceec70040bacbc37a5f4a81b7","hermes_bounded_adoption_refresh":"repository/pcfa06-hermes-bounded-adoption-refresh.json","hermes_bounded_adoption_refresh_sha256":"b5254b0bef3b282557d3c8e3241d8ac5385811fc8c5729c568e958bd5ccacd9d","hosted_controls_issue_body":"handoff/codex-phase0-current-hosted-controls-issue.md","human_status":"docs/CURRENT-OPERATIONAL-STATE.md","launch_entrypoint":"scripts/prepare_codex_phase0_launch.py","launch_semantics_repair":"contracts/pcfa01-launch-control-repair.json","machine_handoff":"handoff/codex-phase0-current-handoff.json","mvcl_contract":"repository/pcfa05-minimum-valuable-consulting-loop.json","mvcl_contract_sha256":"c69e0d81fc4cf4da8de51a8ff3e997752fcbb65f951cdc8f529d5d00762a2f70","operational_state":"repository/current-operational-state.json","permanent_release":"releases/pre-codex-final-reconciliation-2026-08-06.json","permanent_release_gate":"scripts/require_workstream6_final_reconciliation.py","permit_schema":"schemas/codex-phase0-launch-permit.schema.json","product_scope_addendum":"repository/pcfa04-product-scope-implementation-addendum.json","product_scope_addendum_sha256":"4fc34f58149ca5363def1b8e451c12aed8523adc430343cc35301cb2078532ce","repository_posture":"repository/repository-visibility-and-licence-posture.json","repository_posture_sha256":"b9ad8e1d08d52bf0e598f932e432319e12a336f735627f447f1269ce66e4ece1"},"generated_from":"configs/current-operational-state.yaml","historical_package_snapshots":[{"classification":"retained_historical_package_snapshot","package":"WS6.2","path":"contracts/codex-phase0-launch-control.json"},{"classification":"retained_historical_package_snapshot","package":"WS6.2","path":"contracts/workstream6-final-launch-control.json"},{"classification":"retained_historical_package_snapshot","package":"WS6.3","path":"contracts/workstream6-current-status.json"},{"classification":"retained_historical_package_snapshot","package":"WS6.4","path":"repository/canonical-authority-registry.json"},{"classification":"retained_historical_package_snapshot","package":"PCR-04/WS6.1","path":"handoff/codex-phase0-handoff.json"},{"classification":"retained_historical_package_snapshot","package":"WS6.2","path":"handoff/codex-phase0-issue-final.md"},{"classification":"retained_historical_package_snapshot","package":"WS6.3+","path":"handoff/codex-phase0-hosted-controls-issue-final.md"},{"classification":"retained_historical_package_snapshot","package":"WS6.2","path":"handoff/codex-phase0-hosted-controls-attestation.template.json"},{"classification":"retained_historical_package_snapshot","package":"WS6.2","path":"handoff/codex-phase0-clean-macos-attestation.template.json"},{"classification":"retained_historical_package_snapshot","package":"WS6.2","path":"handoff/codex-phase0-founder-authorization.template.json"},{"classification":"retained_historical_package_snapshot","package":"WS6.2","path":"handoff/codex-phase0-launch-ack.template.json"},{"classification":"retained_corrective_package_snapshot","package":"PCFA-01","path":"handoff/pcfa01-codex-phase0-hosted-controls-attestation.template.json"},{"classification":"retained_corrective_package_snapshot","package":"PCFA-01","path":"handoff/pcfa01-codex-phase0-clean-macos-attestation.template.json"},{"classification":"retained_corrective_package_snapshot","package":"PCFA-01","path":"handoff/pcfa01-codex-phase0-founder-authorization.template.json"},{"classification":"retained_corrective_package_snapshot","package":"PCFA-01","path":"handoff/pcfa01-codex-phase0-launch-ack.template.json"},{"classification":"retained_historical_package_snapshot","package":"PCR-06","path":"contracts/hermes-compatibility-pack.json"},{"classification":"retained_historical_package_snapshot","package":"WS6.13","path":"configs/workstream6-phase0-licence-decision-placeholder.yaml"}],"introduced_by":"PCFA-02","launch_permit":{"commit_prohibited":true,"file_mode":"0600","output_directory":".local/codex-phase0-launch","output_path":".local/codex-phase0-launch/permit.json","single_use":true,"stale_on_current_operational_state_change":true,"stale_on_evidence_digest_change":true,"stale_on_issue_body_change":true,"stale_on_main_advance":true,"stale_on_pcfa08_final_acceptance_change":true,"stale_on_permanent_release_change":true},"launch_target":{"implementation_may_start_only_after_valid_permit":true,"merge_authorized":false,"permitted_phase":"Codex Phase 0 only","permitted_tasks":["P0.1","P0.2","P0.3","P0.4"],"phase1_authorized":false,"required_branch":"codex/phase-0-foundation","required_first_commit_ack":"governance/codex-phase0-launch-ack.json","required_pull_request_state":"draft","required_status_check":"Validate final pre-Codex canonical handoff and complete release"},"live_issue_expectations":{"canonical_issue":{"body_must_match_current_file":true,"expected_state_at_permit":"open","number":1},"duplicate_issue":{"expected_state_at_permit":"closed","expected_state_reason_at_permit":"duplicate","number":2},"hosted_controls_issue":{"body_must_match_current_file":true,"expected_state_at_permit":"closed","expected_state_reason_at_permit":"completed","number":19}},"manual_launch_gates":{"approved_main_sha_bound":false,"clean_macos_environment_verified":false,"codex_start_authorized":false,"explicit_founder_phase0_approval_received":false,"github_hosted_controls_verified":false,"historical_branch_cleanup_complete":false,"launch_permit_issued":false,"repository_visibility_private_verified":false},"prohibited_scope":["begin_phase1","merge_phase0_pull_request","activate_runtime","activate_hermes","implement_northstar_product_runtime","enable_real_client_data","use_paid_services_or_trials","request_or_commit_credentials","approve_oauth_or_third_party_access","alter_dns_or_godaddy","send_external_communications","deploy_staging_or_production","autonomous_merge","weaken_tests_or_golden_expectations"],"projection_id":"CURRENT-OPERATIONAL-STATE","release_semantics":{"main_binding_semantics":"release_parent_main_sha_is_exact_integrated_main_before_release_record_commit","record_type":"permanent_post_merge_release","release_id":"PRE-CODEX-FINAL-RECONCILIATION-2026-08-06","release_parent_excluded_from_current_launch_sha_equality":true,"release_parent_must_be_ancestor_of_approved_launch_main":true,"release_record_commit_excluded_from_current_launch_sha_equality":true,"release_record_commit_must_be_ancestor_of_approved_launch_main":true},"repository":"rayrayxing/offdata-os","repository_readiness":{"chat_first_specification_complete":true,"pcfa01_launch_semantics_repaired":true,"pcfa02_current_projection_active":true,"pcfa03_repository_posture_resolved":true,"pcfa04_product_scope_addendum_complete":true,"pcfa05_mvcl_contract_complete":true,"pcfa06_hermes_bounded_adoption_refresh_complete":true,"pcfa07_implementation_backlog_reconciled":true,"pcfa08_final_cross_authority_acceptance_complete":true,"repository_side_corrective_work_complete":true,"workstream6_permanent_release_verified":true},"required_preflight_commands":["bash scripts/run_ws62_ci.sh","python scripts/validate_pcfa01_launch_control.py","python scripts/validate_pcfa02_current_operational_state.py","python scripts/validate_pcfa03_repository_posture.py","python scripts/validate_pcfa04_product_scope_addendum.py","python scripts/validate_pcfa05_mvcl.py","python scripts/validate_pcfa06_hermes_refresh.py","python scripts/validate_pcfa07_backlog_reconciliation.py","python scripts/validate_pcfa08_final_acceptance.py","python scripts/prepare_codex_phase0_launch.py --self-test","python scripts/require_workstream6_final_reconciliation.py"],"schema_version":"1.0.0","state_semantics":{"current_launch_sha_is_bound_only_at_manual_evidence_and_permit_time":true,"current_operational_state_is_the_only_live_machine_readiness_projection":true,"historical_snapshot_fields_are_package_time_facts":true,"historical_snapshot_readiness_must_not_drive_current_launch_decisions":true,"immutable_release_is_evidence_not_current_launch_sha":true,"release_parent_main_sha_is_historical":true},"status":"repository_corrective_state_ready_manual_launch_gates_pending","sync_policy":{"current_issue_files_must_be_synced_only_after_their_reposit